BEGIN_YEARMONTH,BEGIN_DAY,BEGIN_TIME,END_YEARMONTH,END_DAY,END_TIME,EPISODE_ID,EVENT_ID,STATE,STATE_FIPS,YEAR,MONTH_NAME,EVENT_TYPE,CZ_TYPE,CZ_FIPS,CZ_NAME,WFO,BEGIN_DATE_TIME,CZ_TIMEZONE,END_DATE_TIME,INJURIES_DIRECT,INJURIES_INDIRECT,DEATHS_DIRECT,DEATHS_INDIRECT,DAMAGE_PROPERTY,DAMAGE_CROPS,SOURCE,MAGNITUDE,MAGNITUDE_TYPE,FLOOD_CAUSE,CATEGORY,TOR_F_SCALE,TOR_LENGTH,TOR_WIDTH,TOR_OTHER_WFO,TOR_OTHER_CZ_STATE,TOR_OTHER_CZ_FIPS,TOR_OTHER_CZ_NAME,BEGIN_RANGE,BEGIN_AZIMUTH,BEGIN_LOCATION,END_RANGE,END_AZIMUTH,END_LOCATION,BEGIN_LAT,BEGIN_LON,END_LAT,END_LON,EPISODE_NARRATIVE,EVENT_NARRATIVE,DATA_SOURCE
202407,16,130,202407,16,130,192004,1183032,MICHIGAN,26,2024,July,Lightning,C,155,SHIAWASSEE,DTX,16-JUL-24 01:30:00,EST-5,16-JUL-24 01:30:00,0,0,0,0,35.00K,0.00K,Broadcast Media,,,,,,,,,,,,2.0,S,BURTON,2.0,S,BURTON,42.9709,-84.2851,42.9709,-84.2851,A home in Owosso caught fire due to a lightning strike.,"Lightning struck a power pole, with the attached electrical wire leading to a house causing a fire.",CSV
202407,10,1806,202407,10,1806,193827,1197694,VERMONT,50,2024,July,Lightning,C,1,ADDISON,BTV,10-JUL-24 18:06:00,EST-5,10-JUL-24 18:06:00,0,0,0,0,25.00K,0.00K,State Official,,,,,,,,,,,,1.0,N,BRISTOL,1.0,N,BRISTOL,44.14,-73.08,44.14,-73.08,Remnants of Hurricane Beryl tracked across the St. Lawrence Valley of NY and Canada during the afternoon and evening hours of July 10th. Numerous individual supercell-like thunderstorms developed and moved across NY into VT with various wind damage and heavy rainfall.,Structure fire determined to be caused by a lightning strike on a structure on Stony Hill Road.,CSV
202407,15,2135,202407,15,2136,194681,1203994,INDIANA,18,2024,July,Lightning,C,39,ELKHART,IWX,15-JUL-24 21:35:00,EST-5,15-JUL-24 21:36:00,0,0,0,0,35.00K,0.00K,Broadcast Media,,,,,,,,,,,,3.0,NE,MIDDLEBURY,3.0,NE,MIDDLEBURY,41.71,-85.67,41.71,-85.67,"A decaying derecho moved through the area late in the evening on July 15th. Storms raced eastward into southwest Lower Michigan and northern Indiana, prompting several Severe Thunderstorm Warnings for winds up to 70+ mph and Tornado Warnings for embedded rotation along the line. Three tornadoes were confirmed.","Local media confirms a small engine shop was destroyed by fire, likely caused by a lightning strike.",CSV
202412,17,5,202412,17,5,198609,1227978,MISSISSIPPI,28,2024,December,Lightning,C,155,WEBSTER,JAN,17-DEC-24 00:05:00,CST-6,17-DEC-24 00:05:00,0,0,0,0,1.00K,0.00K,Trained Spotter,,,,,,,,,,,,1.0,E,BELLEFONTAINE,1.0,E,BELLEFONTAINE,33.65,-89.31,33.65,-89.31,"Lightning caused tree/powerline damage near Bellefontaine, MS.","Lightning knocked a tree down, downing a utility line in the Bellefontaine community.",CSV
202407,30,2230,202407,30,2230,192758,1189525,TENNESSEE,47,2024,July,Lightning,C,187,WILLIAMSON,OHX,30-JUL-24 22:30:00,CST-6,30-JUL-24 22:30:00,0,4,0,0,250.00K,0.00K,Broadcast Media,,,,,,,,,,,,2.0,E,NOLENSVILLE,2.0,E,NOLENSVILLE,35.947,-86.6487,35.947,-86.6487,"Two lines of thunderstorms moved through Middle Tennessee on July 30, 2024. One of these lines moved through the area during the afternoon while the second arrived late in the evening. Damaging winds were the primary threat with these thunderstorms with numerous reports of downed trees and power lines received. Heavy rain was also reported across the Cumberland Plateau with flooding occurring in portions of Putnam and White counties. In Williamson County, a lightning strike caused a house fire which caused smoke inhalation for four firefighters.",House was stuck by lightning in Nolen Meade subdivision. Fire heavily damaged the attic and top floor. Four firefighters were injured due to smoke inhalation. Damages are a rough estimate.,CSV
202407,28,1720,202407,28,1721,192575,1190733,ALABAMA,1,2024,July,Lightning,C,117,SHELBY,BMX,28-JUL-24 17:20:00,CST-6,28-JUL-24 17:21:00,0,0,0,0,10.00K,0.00K,Public,,,,,,,,,,,,1.0,SW,ARGYLE,1.0,SW,ARGYLE,33.3148,-86.6427,33.3148,-86.6427,"A deep moisture profile and an increase of deep-layer shear over Central Alabama on July 28 resulted in very efficient rainfall occurring over central and northern parts of the region. Precipitable water values of 2.1 to 2.2 inches aided high instantaneous rain rates, at times on the order of 5-7 in/hr. Sporadic flooding occurred in Marion County during the early afternoon as two rounds of heavy rainfall moved through the area. By late afternoon, training thunderstorms over the Cahaba Heights area quickly flooded area homes and streets before another, much larger, round of thunderstorms overtook Jefferson County from the west. Many of the southern and western suburbs of Birmingham experienced flooding of homes and roadways during the early evening hours as 3-5 inches of rain fell across these areas.||The next day, an MCS tracking into northeast Alabama from Tennessee resulted in several trees being blown down in Cherokee County, especially the Centre and Cedar Bluff areas.",A residence along Rabbit Run sustained damage from a fire resulting from a lightning strike. The owner witnessed a lightning flash followed by a sparking TV and burning odor. No reported injuries. A lightning strike was confirmed via lightning network data and the residence was surveyed by the fire marshal.,CSV
202404,1,1800,202404,1,1800,190497,1178273,TEXAS,48,2024,April,Lightning,C,251,JOHNSON,FWD,01-APR-24 18:00:00,CST-6,01-APR-24 18:00:00,0,0,0,0,250.00K,0.00K,Broadcast Media,,,,,,,,,,,,0.0,N,VENUS,0.0,N,VENUS,32.43,-97.12,32.43,-97.12,A lead shortwave associated with an upper trough over the Desert Southwest helped initiate thunderstorms along and ahead of a dryline the afternoon and evening of April 1. Storms developed across the Big Country and spread east across North Texas. Several storms became severe and produced primarily large hail across several locations near and north of I-20 and along and west of I-35. The largest sized hail reported was Grapefruit sized (4.5) in Wise County.,Lightning started a house fire that resulted in a total loss of the house. The exact location of the house is unknown.,CSV
202404,8,2315,202404,8,2315,190689,1173869,TEXAS,48,2024,April,Lightning,C,181,GRAYSON,FWD,08-APR-24 23:15:00,CST-6,08-APR-24 23:15:00,0,0,0,0,100.00K,0.00K,Emergency Manager,,,,,,,,,,,,1.0,NW,DENISON,1.0,NW,DENISON,33.76,-96.56,33.76,-96.56,"Multiple rounds of thunderstorms occurred from Monday April 8 through Wednesday April 10 as a deep low pressure system moved east through the Rockies, eventually transitioning to an open trough as it traversed the Plains. The first round of thunderstorms began immediately after the region experienced a total solar eclipse! Large hail was the primary severe weather occurrence on April 8th, though flooding became a primary issue on the 9th and 10th following several rounds of showers and storms.",Emergency management reported a tank battery fire caused by a lightning strike near the intersection of FM 1417 and Davy Ln in Denison.,CSV
202406,9,1930,202406,9,2030,193540,1195826,IDAHO,16,2024,June,Lightning,C,81,TETON,PIH,09-JUN-24 19:30:00,MST-7,09-JUN-24 20:30:00,0,0,0,0,0.10K,0.00K,Utility Company,,,,,,,,,,,,3.0,N,VICTOR,3.0,N,VICTOR,43.6434,-111.12,43.6434,-111.12,Several reports of severe weather were received through the afternoon.,Fall River Rural Electric Cooperative reported a lightning strike knocked out power to several hundred customers in the areas of Idaho 33 and W 5000 S for about an hour near Victor.,CSV
202401,22,1700,202401,22,1700,187884,1153984,CALIFORNIA,6,2024,January,Lightning,C,65,RIVERSIDE,SGX,22-JAN-24 17:00:00,PST-8,22-JAN-24 17:00:00,0,0,0,0,1.00K,0.00K,Public,,,,,,,,,,,,0.0,N,BANNING,0.0,N,BANNING,33.93,-116.88,33.93,-116.88,"Historic flooding occurred on January 22nd. Heavy rainfall occurred between 8 am and noon across western San Diego county. The heaviest rainfall occurred between 9 am and 11 am in the east side of the city of San Diego in Encanto and Lemon Grove to Spring Valley. Rainfall rates were observed at 1.5 to 2.5 inches in 60 minutes and resulted in 1000 year return intervals. Over 200 water rescues at homes, streets and in water channels were performed by San Diego Fire and Rescue. FEMA found 1000 homes damaged in the following weeks and 600 were declared major damage resulting in up to 31 million in damage claims and displaced residents, including 1200 households, in temporary shelters for several months. San Diego County EOC was activated on January 22 and remained activated at a low level into May 2024. The areas flooded the most were Mountain View, Encanto, Valencia Park, Shelltown, Southcrest, and Lincoln Park.",Lightning struck a palm tree and started a small fire in Banning.,CSV
202406,24,1400,202406,24,2000,191568,1179415,CALIFORNIA,6,2024,June,Lightning,C,19,FRESNO,HNX,24-JUN-24 14:00:00,PST-8,24-JUN-24 20:00:00,0,0,0,0,1.00M,0.00K,Fire Department/Rescue,,,,,,,,,,,,2.0,W,SQUAW VLY,2.0,W,SQUAW VLY,36.7456,-119.2836,36.7456,-119.2836,Moisture from the remains of Atlantic Tropical Storm Alberto wrapped around high pressure centered over the Desert Southwest the pulled up north behind it into central California on June 24 and 25. The result of this was thunderstorms which had little to no precipitation with them on both days. One cluster of thunderstorms produced dry lightning which ignited several wildfires east of Reedley during the afternoon of June 24 which became known as the Fresno Lightning Complex Fires.,Dry lightning sparked several wildfires during the afternoon and evening of June 24 east of Reedley and Sanger. These fires became known as the Fresno Lightning Complex which resulted in several evacuations as the fires spread rapidly due to heavy fuel loading. The transmitter for KVPT Channel 18 was destroyed by one of the fires.,CSV
202406,27,1527,202406,27,1527,191502,1179147,SOUTH CAROLINA,45,2024,June,Lightning,C,51,HORRY,ILM,27-JUN-24 15:27:00,EST-5,27-JUN-24 15:27:00,0,0,0,0,3.00K,0.00K,Broadcast Media,,,,,,,,,,,,1.0,NW,CHERRY GROVE BEACH,1.0,NW,CHERRY GROVE BEACH,33.83,-78.64,33.83,-78.64,Lightning caused some structural damage in the Myrtle Beach area.,Lightning caused an attic fire in a home on 33rd Avenue in Cherry Grove.,CSV
202406,27,1532,202406,27,1532,191502,1179148,SOUTH CAROLINA,45,2024,June,Lightning,C,51,HORRY,ILM,27-JUN-24 15:32:00,EST-5,27-JUN-24 15:32:00,0,0,0,0,4.00K,0.00K,Broadcast Media,,,,,,,,,,,,0.0,N,LITTLE RIVER,0.0,N,LITTLE RIVER,33.87,-78.62,33.87,-78.62,Lightning caused some structural damage in the Myrtle Beach area.,"Media reported an apartment fire caused by lightning along Pinehurst Circle in Little River, SC.",CSV
202404,8,2100,202404,8,2100,190689,1178274,TEXAS,48,2024,April,Lightning,C,121,DENTON,FWD,08-APR-24 21:00:00,CST-6,08-APR-24 21:00:00,0,0,0,0,500.00K,0.00K,Broadcast Media,,,,,,,,,,,,1.0,NNE,SMOOTS,1.0,NNE,SMOOTS,33.0901,-97.1949,33.0901,-97.1949,"Multiple rounds of thunderstorms occurred from Monday April 8 through Wednesday April 10 as a deep low pressure system moved east through the Rockies, eventually transitioning to an open trough as it traversed the Plains. The first round of thunderstorms began immediately after the region experienced a total solar eclipse! Large hail was the primary severe weather occurrence on April 8th, though flooding became a primary issue on the 9th and 10th following several rounds of showers and storms.","Lightning started a house fire in the 900 blk of Stonecrest Road in Argyle that heavily damaged the home, likely resulting in a total loss.",CSV
202406,13,1623,202406,13,1624,191587,1179653,INDIANA,18,2024,June,Lightning,C,141,ST. JOSEPH,IWX,13-JUN-24 16:23:00,EST-5,13-JUN-24 16:24:00,0,0,0,0,0.50K,0.00K,Public,,,,,,,,,,,,1.0,SW,GRANGER,1.0,SW,GRANGER,41.74,-86.14,41.74,-86.14,"Severe thunderstorms along the Indiana, Michigan state line resulted in numerous reports of downed trees and powerlines around Elkhart, South Bend and surrounding communities.",Flag pole stuck by lightning. Flag pole snapped.,CSV
202406,27,1100,202406,27,1100,191913,1182322,ARIZONA,4,2024,June,Lightning,C,15,MOHAVE,VEF,27-JUN-24 11:00:00,MST-7,27-JUN-24 11:00:00,0,0,0,0,5.00K,0.00K,Park/Forest Service,,,,,,,,,,,,1.0,SW,PIPE SPRING,1.0,SW,PIPE SPRING,36.8622,-112.7367,36.8622,-112.7367,Monsoon moisture and an approaching trough axis fueled isolated thunderstorms over northern Mohave County. One storm produced lightning damage and hail.,Lightning caused an outage of the phone system and also damaged a tree.,CSV
202406,25,155,202406,25,155,191688,1180468,WISCONSIN,55,2024,June,Lightning,C,83,OCONTO,GRB,25-JUN-24 01:55:00,CST-6,25-JUN-24 01:55:00,0,0,0,0,20.00K,0.00K,Broadcast Media,,,,,,,,,,,,2.0,NE,CHASE,2.0,NE,CHASE,44.72,-88.14,44.72,-88.14,"Isolated thunderstorms developed ahead of a warm front during the late evening on Monday (6/24) producing large hail.  A Quasi-Linear Convective System developed across northwest Wisconsin and tracked southeast through northeastern Wisconsin during the overnight hours into early Tuesday morning (6/25).  The storms produced widespread straight-line wind damage, an isolated tornado, and some flash flooding across the region.",A barn was destroyed by a fire started by lightning in the town of Chase.,CSV
202406,25,608,202406,25,608,192614,1194987,ILLINOIS,17,2024,June,Lightning,C,111,MCHENRY,LOT,25-JUN-24 06:08:00,CST-6,25-JUN-24 06:08:00,1,0,0,0,0.00K,0.00K,Broadcast Media,,,,,,,,,,,,3.0,NNW,MARENGO,3.0,NNW,MARENGO,42.2918,-88.6254,42.2918,-88.6254,"A cluster of strong to severe storms moved across Chicagoland during the night of the 24th immediately followed by a line of storms which went on to impact northern Illinois through the morning of the 25th. The storms produced mostly wind damage, mainly to trees, as well as some marginally severe hail. The storms also resulted in one man being struck by lightning in Marengo.",An employee of Nichols Farm and Orchard in Marengo was injured when he was struck by lightning. It's believed that lightning struck a tree and then traveled through the man who was nearby. He was transported to the hospital with minor to moderate injuries.,CSV
202406,10,1855,202406,10,1855,193428,1196428,SOUTH CAROLINA,45,2024,June,Lightning,C,15,BERKELEY,CHS,10-JUN-24 18:55:00,EST-5,10-JUN-24 18:55:00,0,0,0,0,5.00K,,Emergency Manager,,,,,,,,,,,,2.0,SSE,CARNES XRD,2.0,SSE,CARNES XRD,33.04,-80.09,33.04,-80.09,"Mid-level shortwave energy approaching the region along with a nearly stationary cold front across the area provided ample forcing within an environment displaying strong instability, deep moisture, ample shear and very strong downdraft CAPE, leading to strong and severe thunderstorms capable of producing large hail and damaging winds across Southeast South Carolina. A notable supercell thunderstorm developed near the Savannah River during the afternoon and tracked northeast through the Tri-County Area during early evening hours, producing a long and wide swath of damaging winds and large hail across inland portions of the Charleston Metro Area.",Lightning struck a tree causing it to fall on a house along Fredericksburg Drive. Another lightning strike hit a tree causing it to lean onto a power line off of Myers Road.,CSV
202406,22,1309,202406,22,1309,192396,1195188,MASSACHUSETTS,25,2024,June,Lightning,C,3,BERKSHIRE,ALY,22-JUN-24 13:09:00,EST-5,22-JUN-24 13:09:00,0,0,0,0,7.50K,,Fire Department/Rescue,,,,,,,,,,,,1.0,N,WEST STOCKBRIDGE CNT,1.0,N,WEST STOCKBRIDGE CNT,42.32,-73.4,42.32,-73.4,"Scattered showers and thunderstorms impacted Berkshire County on Saturday, June 22. Isolated instances of thunderstorms becoming severe resulted in numerous instances of downed trees and wires with an isolated instance of a downed power pole and a tree downed on a house. Additionally, a barn fire was reported as a result of a lightning strike.",Fire department reported a barn fire started by a lightning strike.,CSV
202406,25,1830,202406,25,1830,192825,1190252,IOWA,19,2024,June,Lightning,C,121,MADISON,DMX,25-JUN-24 18:30:00,CST-6,25-JUN-24 18:30:00,0,0,0,0,250.00K,0.00K,Emergency Manager,,,,,,,,,,,,1.0,N,WINTERSET,1.0,N,WINTERSET,41.34,-94.02,41.34,-94.02,"Scattered convection occurred throughout the day across the area as a weak cold front dropped slowly south across the area. By afternoon the front had largely stalled near the I-80 corridor and more vigorous convection developed along the front, fed by high instability exceeding 3000 J/kg and steep mid level lapse rates of 7 to 8 C/km. Storms first began near Newton and then back built towards the west along the boundary through the evening. Storms produced large hail and stretching resulted in a huge number of funnel clouds, including pictures with a least visible at the same time. Later in the evening a wave across Nebraska moved into Iowa, sweeping east along the instability gradient that the earlier evening convection developed on. A few damaging wind gusts occurred with this line of storms, however it remained sub severe most of the night.",Lightning strike resulted in a house fire. Home a total loss. Time estimated.,CSV
202406,30,930,202406,30,930,193006,1191476,FLORIDA,12,2024,June,Lightning,C,11,BROWARD,MFL,30-JUN-24 09:30:00,EST-5,30-JUN-24 09:30:00,0,0,1,0,0.00K,0.00K,Broadcast Media,,,,,,,,,,,,6.0,NE,MIRAMAR,6.0,NE,MIRAMAR,26.067,-80.3426,26.067,-80.3426,"A mid-level disturbance moved across the southern peninsula of Florida on June 30th, which led to abundant convective activity across the region. Scattered showers and thunderstorms developed across the eastern metropolitan area, especially Broward County, throughout the morning and early afternoon.",Broadcast media reported that a 19-year-old male was killed by lightning strike as he was jogging at Vista View Park in Davie during a thunderstorm.,CSV
202406,1,1130,202406,1,1130,193457,1196651,TEXAS,48,2024,June,Lightning,C,439,TARRANT,FWD,01-JUN-24 11:30:00,CST-6,01-JUN-24 11:30:00,0,0,0,0,50.00K,0.00K,Broadcast Media,,,,,,,,,,,,1.0,NNE,KELLER,1.0,NNE,KELLER,32.944,-97.2448,32.944,-97.2448,"Upper level disturbances interacted with leftover surface outflow boundaries from nocturnal MCSs and allowed for scattered strong to severe storms across the region each afternoon from June 1st to June 3rd. A combination of hail, damaging winds, and flash flooding occurred, but an EF-U tornado also occurred in Henderson County on the 3rd. One life was lost June 3rd in Henderson County due to a falling tree in straight-line winds.",Lightning started a fire in the attic of a home on Cross Timbers Drive in Keller.,CSV
202406,20,1600,202406,20,1600,193595,1196101,PUERTO RICO,99,2024,June,Lightning,C,13,ARECIBO,SJU,20-JUN-24 16:00:00,AST-4,20-JUN-24 16:00:00,0,0,0,0,1.00K,0.00K,Broadcast Media,,,,,,,,,,,,2.0,N,ARECIBO,2.0,N,ARECIBO,18.4463,-66.6699,18.4463,-66.6699,"Series of troughs enhanced afternoon convection during the week. Flooding, thunderstorm wind and hail reports were received at some point during the week. Activity caused a landslide in Bayamon. Lightning even struck the roof of a residence, causing injuries and damaged appliances, furniture, and the roof of the house.","Lightning struck the roof of a residence in Barrio Santana, Arecibo. The news report says that a 60-year-old woman was injured by debris from the roof and that her phone exploded.",CSV
202406,2,1316,202406,2,1316,192977,1191247,FLORIDA,12,2024,June,Lightning,C,129,WAKULLA,TAE,02-JUN-24 13:16:00,EST-5,02-JUN-24 13:16:00,0,0,0,0,2.00K,0.00K,Utility Company,,,,,,,,,,,,1.0,WNW,SOPCHOPPY,1.0,WNW,SOPCHOPPY,30.07,-84.5,30.07,-84.5,A summertime pattern was in place across the tri-state area with weak steering winds and high instability. The result was scattered to numerous showers and thunderstorms with gusty winds and localized flash flooding.,Lightning resulted in a power outage near Sopchoppy.,CSV
202404,14,1750,202404,14,1750,189026,1165514,PENNSYLVANIA,42,2024,April,Lightning,C,81,LYCOMING,CTP,14-APR-24 17:50:00,EST-5,14-APR-24 17:50:00,0,0,0,0,10.00K,0.00K,Amateur Radio,,,,,,,,,,,,1.0,ESE,(IPT)WILLIAMSPORT AR,1.0,ESE,(IPT)WILLIAMSPORT AR,41.2471,-76.9052,41.2471,-76.9052,"A cold front dropped southward across Central Pennsylvania during the afternoon and evening hours of April 14, 2024, accompanied by a line of showers and storms. The storms developed in a relatively dry environment, with plentiful shear and adequate CAPE. Damaging winds were the primary issue, although there were two reports of quarter-sized hail. The storms weakened as they moved into southern Pennsylvania late in the evening.",A thunderstorm produced lightning that struck a house on the 1200 block of Broad Street in Montoursville and caused damage.,CSV
202404,14,1832,202404,14,1832,189026,1165533,PENNSYLVANIA,42,2024,April,Lightning,C,27,CENTRE,CTP,14-APR-24 18:32:00,EST-5,14-APR-24 18:32:00,0,0,0,0,10.00K,0.00K,911 Call Center,,,,,,,,,,,,1.0,NW,PINE GROVE MILLS,1.0,NW,PINE GROVE MILLS,40.7397,-77.8811,40.7397,-77.8811,"A cold front dropped southward across Central Pennsylvania during the afternoon and evening hours of April 14, 2024, accompanied by a line of showers and storms. The storms developed in a relatively dry environment, with plentiful shear and adequate CAPE. Damaging winds were the primary issue, although there were two reports of quarter-sized hail. The storms weakened as they moved into southern Pennsylvania late in the evening.",Lightning with a thunderstorm struck a tree near a residence on Rosemont Drive in Pine Grove Mills with a fire spreading onto the second floor of the home.,CSV
202404,1,130,202404,1,131,189219,1163688,ILLINOIS,17,2024,April,Lightning,C,203,WOODFORD,ILX,01-APR-24 01:30:00,CST-6,01-APR-24 01:31:00,0,0,0,0,50.00K,0.00K,Emergency Manager,,,,,,,,,,,,2.0,NW,METAMORA,2.0,NW,METAMORA,40.7933,-89.3729,40.7933,-89.3729,A nearly stationary frontal boundary draped across central Illinois triggered scattered showers and thunderstorms during the night of March 31st into the pre-dawn hours of April 1st.  One of the cells produced a lightning strike that damaged a building near the Metamora Golf Course in Metamora in Woodford County.,Lightning struck and damaged a building near Metamora Fields Golf Club in Metamora in Woodford County.  A power outage also occurred due to the lightning strike.,CSV
202407,20,1430,202407,20,1431,194482,1202081,GEORGIA,13,2024,July,Lightning,C,43,CANDLER,CHS,20-JUL-24 14:30:00,EST-5,20-JUL-24 14:31:00,0,0,0,0,15.00K,0.00K,Broadcast Media,,,,,,,,,,,,1.0,E,METTER MUNI ARPT,1.0,E,METTER MUNI ARPT,32.37,-82.07,32.37,-82.07,Scattered to numerous thunderstorms developed in the early afternoon hours across southeast Georgia and moved toward the coast. A few of these thunderstorms became strong enough to produce gusty winds and cloud to ground lightning strikes.,"Local broadcast media reported that lightning struck a car driving on Interstate 16 near exit 104, damaging the electrical system and disabling the vehicle. None of the passengers were injured.",CSV
202407,19,1720,202407,19,1721,194478,1202064,SOUTH CAROLINA,45,2024,July,Lightning,C,13,BEAUFORT,CHS,19-JUL-24 17:20:00,EST-5,19-JUL-24 17:21:00,0,0,0,0,10.00K,0.00K,Fire Department/Rescue,,,,,,,,,,,,1.0,WNW,PRITCHARDVILLE,1.0,WNW,PRITCHARDVILLE,32.24,-80.99,32.24,-80.99,"Numerous thunderstorms developed in the late afternoon hours across Beaufort County. These thunderstorms produced frequent cloud to ground lightning, with several lightning strikes to homes and other structures.",A lightning strike started a structure fire on Breakwater Court.,CSV
202407,16,2009,202407,16,2010,194475,1202053,GEORGIA,13,2024,July,Lightning,C,103,EFFINGHAM,CHS,16-JUL-24 20:09:00,EST-5,16-JUL-24 20:10:00,0,0,0,0,10.00K,0.00K,Emergency Manager,,,,,,,,,,,,2.0,ESE,GUYTON,2.0,ESE,GUYTON,32.32,-81.35,32.32,-81.35,Isolated thunderstorms lingered into the evening hours within a typical summertime environment. One storm became strong enough to produce damaging wind gusts and frequent lightning in Effingham County.,Effingham County Emergency Management reported a lightning strike to a home in Guyton which caused a fire. No injuries were reported.,CSV
202407,26,1830,202407,26,1831,194493,1202104,GEORGIA,13,2024,July,Lightning,C,51,CHATHAM,CHS,26-JUL-24 18:30:00,EST-5,26-JUL-24 18:31:00,0,0,0,0,10.00K,0.00K,Emergency Manager,,,,,,,,,,,,2.0,SSW,(SVN)HUNTER AAF SAVA,2.0,SSW,(SVN)HUNTER AAF SAVA,32.0,-81.14,32.0,-81.14,"Isolated to scattered thunderstorms developed across portions of southeast Georgia in the late afternoon hours. A couple of these thunderstorms became strong enough to produce gusty winds and cloud to ground lightning strikes. One storm interacted with a nearby mesoscale boundary and prompted a Tornado Warning across Chatham County. A funnel cloud was reported on two different occasions, but the storm did not produce any known damage.",Chatham County Emergency Management reported a house struck by lightning at N Leeds Gate Road.,CSV
202407,26,1750,202407,26,1751,194493,1202106,GEORGIA,13,2024,July,Lightning,C,51,CHATHAM,CHS,26-JUL-24 17:50:00,EST-5,26-JUL-24 17:51:00,0,0,0,0,10.00K,0.00K,Emergency Manager,,,,,,,,,,,,2.0,NW,PARADISE PARK,2.0,NW,PARADISE PARK,31.99,-81.1,31.99,-81.1,"Isolated to scattered thunderstorms developed across portions of southeast Georgia in the late afternoon hours. A couple of these thunderstorms became strong enough to produce gusty winds and cloud to ground lightning strikes. One storm interacted with a nearby mesoscale boundary and prompted a Tornado Warning across Chatham County. A funnel cloud was reported on two different occasions, but the storm did not produce any known damage.",Chatham County Emergency Management reported that lightning struck a home on West Creighton Place.,CSV
