BEGIN_YEARMONTH,BEGIN_DAY,BEGIN_TIME,END_YEARMONTH,END_DAY,END_TIME,EPISODE_ID,EVENT_ID,STATE,STATE_FIPS,YEAR,MONTH_NAME,EVENT_TYPE,CZ_TYPE,CZ_FIPS,CZ_NAME,WFO,BEGIN_DATE_TIME,CZ_TIMEZONE,END_DATE_TIME,INJURIES_DIRECT,INJURIES_INDIRECT,DEATHS_DIRECT,DEATHS_INDIRECT,DAMAGE_PROPERTY,DAMAGE_CROPS,SOURCE,MAGNITUDE,MAGNITUDE_TYPE,FLOOD_CAUSE,CATEGORY,TOR_F_SCALE,TOR_LENGTH,TOR_WIDTH,TOR_OTHER_WFO,TOR_OTHER_CZ_STATE,TOR_OTHER_CZ_FIPS,TOR_OTHER_CZ_NAME,BEGIN_RANGE,BEGIN_AZIMUTH,BEGIN_LOCATION,END_RANGE,END_AZIMUTH,END_LOCATION,BEGIN_LAT,BEGIN_LON,END_LAT,END_LON,EPISODE_NARRATIVE,EVENT_NARRATIVE,DATA_SOURCE
202408,28,1730,202408,28,1731,195889,1211747,NORTH DAKOTA,38,2024,August,Lightning,C,15,BURLEIGH,BIS,28-AUG-24 17:30:00,CST-6,28-AUG-24 17:31:00,3,0,0,0,1.00K,0.00K,Public,,,,,,,,,,,,2.0,NNW,STERLING,2.0,NNW,STERLING,46.8534,-100.2923,46.8534,-100.2923,"Thunderstorms developed over southwest into south central North Dakota in an environment of very strong instability and elevated deep layer shear. The atmosphere remained capped until early in the evening when rapid thunderstorm development occurred. The initial severe storm produced a tornado near Selfridge in Sioux County, which broke power poles. Based on the damage done this this tornado was rated EF-1. Additional storms developed ahead of a frontal boundary, producing large hail and damaging winds. One storm over southern Morton County south of St. Anthony produced a four-inch diameter hailstone. In the town of St. Anthony, wind driven hail produced extensive damage to structures, with the siding shredded on some homes. Later in the evening, a storm passed over and to the south of Sterling in Burleigh County, producing 100 mph straight line winds which dislodged a large grain bin, broke or severely damaged 15 power poles, and significantly damaged a large sunflower field. The storm then moved towards Steele in Kidder County where it produced a tornado just to the east of town. The tornado crossed the path of a stopped train and knocked about 40 railroad cars off the tracks. An oats field was destroyed and several hardwood trees were snapped. This tornado was rated EF-1. Additional storms then continued through the evening producing hail over south central and parts of north central North Dakota before moving to the east and dissipating. Along with the severe weather, three male teenagers were struck by lighting to the north of Sterling in Burleigh County while returning to their vehicle after goose hunting. All three were injured and required medical attention at a hospital emergency room, but were able to quickly recover from their injuries.","A NWS meteorologist interviewed one of the victims. Three teenage males were goose hunting when thunderstorms approached their area. They packed up their equipment and were walking to their pickup truck close by when all three were struck by lighting. The victims were knocked down, and when they were able to get up they continued their return to the pickup truck and drove to a hospital emergency room in Bismarck.  One victim suffered a small brain bleed and reduced hearing. The second victim suffered a large cut in his hand along with a flash burn to his eyes. The third victim suffered tingling sensations in his right foot along with a headache. All the victims recovered from their injuries. The goose blinds they were carrying were severely damaged in the incident.",CSV
202408,17,1330,202408,17,1330,196292,1214920,MISSISSIPPI,28,2024,August,Lightning,C,23,CLARKE,JAN,17-AUG-24 13:30:00,CST-6,17-AUG-24 13:30:00,0,0,0,0,100.00K,0.00K,Broadcast Media,,,,,,,,,,,,2.0,SSW,DE SOTO,2.0,SSW,DE SOTO,31.94,-88.728,31.94,-88.728,"Scattered strong to severe thunderstorms developed across various portions of Mississippi during the afternoons of August 14th, 16th, and 17th. These storms caused scattered wind damage from microbursts.",Lightning caused a house fire along County Road 265.,CSV
202408,14,2200,202408,14,2201,195436,1215106,KANSAS,20,2024,August,Lightning,C,173,SEDGWICK,ICT,14-AUG-24 22:00:00,CST-6,14-AUG-24 22:01:00,1,0,0,0,0.00K,0.00K,Fire Department/Rescue,,,,,,,,,,,,3.0,WSW,WICHITA,3.0,WSW,WICHITA,37.6798,-97.3805,37.6798,-97.3805,"A line of severe storms produced damaging winds across much of central and southcentral Kansas during the evening and nighttime hours of August 14th. There were several reports of structural damage with wind gusts up to 80 mph reported for the strongest of these storms. Schools in the towns of Douglass and Sedgwick were cancelled the following day due to damage caused by these storms. These storms also brought frequent cloud-to-ground lightning, and a person was injured by a nearby lightning strike.",Emergency management relayed a report from emergency medical service crews of an individual transported to the hospital after a person's ear drum ruptured from a nearby lightning strike.,CSV
202408,17,2310,202408,17,2310,196116,1214141,UTAH,49,2024,August,Lightning,C,3,BOX ELDER,SLC,17-AUG-24 23:10:00,MST-7,17-AUG-24 23:10:00,2,0,1,0,0.00K,0.00K,Broadcast Media,,,,,,,,,,,,1.0,E,CORINNE,1.0,E,CORINNE,41.55,-112.099,41.55,-112.099,Thunderstorms brought gusty winds to much of Utah and flash flooding to southern Utah.,"A lightning strike capsized a fishing boat with three passengers on board, throwing the passengers into the river, leading to one fatality and two injuries. First responders were called just after midnight local time.",CSV
202408,6,1840,202408,6,1840,194220,1200175,PENNSYLVANIA,42,2024,August,Lightning,C,129,WESTMORELAND,PBZ,06-AUG-24 18:40:00,EST-5,06-AUG-24 18:40:00,0,0,0,0,5.00K,0.00K,Law Enforcement,,,,,,,,,,,,1.0,E,PLEASANT VLY,1.0,E,PLEASANT VLY,40.38,-79.66,40.38,-79.66,"A shortwave trough over the Great Lakes interacting with a quasi-stationary boundary over eastern Ohio and western PA spawned severe weather from mid afternoon through late evening. MLCAPE near 2000 J/kg along with a relatively strong, elongated shear profiles led to an environment for strong to severe winds and possible tornadoes.",A house was struck by lightning in Penn Township.,CSV
202408,30,1345,202408,30,1345,194043,1199214,TENNESSEE,47,2024,August,Lightning,C,35,CUMBERLAND,OHX,30-AUG-24 13:45:00,CST-6,30-AUG-24 13:45:00,1,0,0,0,0.00K,0.00K,Broadcast Media,,,,,,,,,,,,2.0,SW,ISOLINE,2.0,SW,ISOLINE,36.0579,-85.0702,36.0579,-85.0702,"More summertime thunderstorms developed across Middle Tennessee during the afternoon and evening hours of August 30, 2024. Gusty winds were the primary threat with these thunderstorms, and one particular storm in Manchester snapped a tree onto a powerline. Elsewhere, a man in Crossville was severely injured after being struck by lightning.",Lightning reportedly struck and severely injured a man worked in a tree along Wilson Road in Crossville. The man was air flighted to a Knoxville hospital due to internal burns and a broken vertebra. His injuries were not life threatening.,CSV
202408,2,2258,202408,2,2258,192805,1189726,INDIANA,18,2024,August,Lightning,C,79,JENNINGS,IND,02-AUG-24 22:58:00,EST-5,02-AUG-24 22:58:00,2,0,0,0,1.00K,0.00K,Broadcast Media,,,,,,,,,,,,2.0,SSW,QUEENSVILLE,2.0,SSW,QUEENSVILLE,39.029,-85.682,39.029,-85.682,"A lingering, small upper level short wave slowly departing the Midwest, combined with adequate daytime heating to promote scattered afternoon showers across much of central Indiana with a few embedded non-severe thunderstorms.|One thunderstorm crossing Jennings County produced a cloud-to-ground lightning strike that struck a tent in the County Squire Lakes neighborhood northwest of North Vernon.","Two persons inside the tent, an 18-year-old male and a juvenile female who was 9 months pregnant, were both injured.  Both victims were treated for their injuries, and were in stable yet serious condition as of the evening of August 3rd;  the baby was reported unharmed.",CSV
202408,3,1506,202408,3,1506,195454,1208640,LOUISIANA,22,2024,August,Lightning,C,33,EAST BATON ROUGE,LIX,03-AUG-24 15:06:00,CST-6,03-AUG-24 15:06:00,0,0,0,0,100.00K,0.00K,Broadcast Media,,,,,,,,,,,,1.0,E,MILLERVILLE,1.0,E,MILLERVILLE,30.45,-91.02,30.45,-91.02,"A pretty typical summertime convective setup was in place with a cold front decaying as it reached southern Louisiana and Mississippi while daytime highs were in the mid to upper 90s. Robust updrafts were abundant from high low level moisture, very warm surface temperatures and low level lift from the stalling frontal boundary. The resultant thunderstorms produced severe hail and damaging wind gusts. 2 homes were also damaged by lightning strikes.",Local broadcast media news story showed that a tree fell onto a house and car on Shadybrook Drive near Sherwood Forest Boulevard after being struck by lightning. No reports of injuries. Time was estimated by a combination of radar and lightning data.,CSV
202408,3,1530,202408,3,1530,195454,1208646,LOUISIANA,22,2024,August,Lightning,C,33,EAST BATON ROUGE,LIX,03-AUG-24 15:30:00,CST-6,03-AUG-24 15:30:00,0,0,0,0,300.00K,0.00K,Fire Department/Rescue,,,,,,,,,,,,1.0,NE,SUNNYBROOK,1.0,NE,SUNNYBROOK,30.5147,-91.0521,30.5147,-91.0521,"A pretty typical summertime convective setup was in place with a cold front decaying as it reached southern Louisiana and Mississippi while daytime highs were in the mid to upper 90s. Robust updrafts were abundant from high low level moisture, very warm surface temperatures and low level lift from the stalling frontal boundary. The resultant thunderstorms produced severe hail and damaging wind gusts. 2 homes were also damaged by lightning strikes.",The Central Fire Department posted a picture on social media showing home on fire caused by a lightning strike in Central on Bryce Canyon Drive. Time estimated by radar.,CSV
202408,26,1754,202408,26,1754,196143,1213490,VIRGINIA,51,2024,August,Lightning,C,760,RICHMOND (C),AKQ,26-AUG-24 17:54:00,EST-5,26-AUG-24 17:54:00,0,0,0,0,10.00K,0.00K,Broadcast Media,,,,,,,,,,,,47.0,SW,WELLFORD,47.0,SW,WELLFORD,37.49,-77.48,37.49,-77.48,Scattered storms developed across central Virginia on August 26 under a belt of northwest flow aloft. A few storms became severe and produced damaging winds across portions of central Virginia.,Broadcast Media reported a fire caused by lightning at the Cardinal Elementary School.,CSV
202408,26,1735,202408,26,1735,196143,1213492,VIRGINIA,51,2024,August,Lightning,C,41,CHESTERFIELD,AKQ,26-AUG-24 17:35:00,EST-5,26-AUG-24 17:35:00,0,0,0,0,20.00K,0.00K,Broadcast Media,,,,,,,,,,,,1.0,W,MIDLOTHIAN,1.0,W,MIDLOTHIAN,37.5,-77.67,37.5,-77.67,Scattered storms developed across central Virginia on August 26 under a belt of northwest flow aloft. A few storms became severe and produced damaging winds across portions of central Virginia.,Broadcast Media reported a lightning strike to a house in the 14300 Block of Charter Landing Drive near Midlothian High School that caused a fire in the attic. No injuries were reported.,CSV
202408,26,1737,202408,26,1737,196143,1213494,VIRGINIA,51,2024,August,Lightning,C,41,CHESTERFIELD,AKQ,26-AUG-24 17:37:00,EST-5,26-AUG-24 17:37:00,0,0,0,0,20.00K,0.00K,Broadcast Media,,,,,,,,,,,,3.0,SE,BON AIR,3.0,SE,BON AIR,37.49,-77.53,37.49,-77.53,Scattered storms developed across central Virginia on August 26 under a belt of northwest flow aloft. A few storms became severe and produced damaging winds across portions of central Virginia.,Broadcast Media reported a lightning strike to a home in the 1700 Block of Bellows Drive off of Elkhardt Road which caused a house fire. No injuries were reported.,CSV
202408,15,1522,202408,15,1535,196090,1213152,IDAHO,16,2024,August,Lightning,C,5,BANNOCK,PIH,15-AUG-24 15:22:00,MST-7,15-AUG-24 15:35:00,0,0,0,0,8.00K,0.00K,Fire Department/Rescue,,,,,,,,,,,,1.0,WNW,CHUBBUCK,1.0,WNW,CHUBBUCK,42.9255,-112.4683,42.9255,-112.4683,Several reports of severe weather received.,Lightning struck a power pole resulting in a fire and part of a tree caught in wires.,CSV
202408,15,1642,202408,15,1700,196090,1213165,IDAHO,16,2024,August,Lightning,C,43,FREMONT,PIH,15-AUG-24 16:42:00,MST-7,15-AUG-24 17:00:00,0,0,0,0,0.10K,0.00K,Emergency Manager,,,,,,,,,,,,6.0,NNW,PARKER,6.0,NNW,PARKER,44.0302,-111.8162,44.0302,-111.8162,Several reports of severe weather received.,Fremont County Emergency Manager reported lightning strike started a fire on the west side of Red Rd.,CSV
202408,2,1757,202408,2,1758,192837,1190711,ALABAMA,1,2024,August,Lightning,C,117,SHELBY,BMX,02-AUG-24 17:57:00,CST-6,02-AUG-24 17:58:00,0,0,0,0,15.00K,0.00K,Broadcast Media,,,,,,,,,,,,1.0,WNW,SILURIA,1.0,WNW,SILURIA,33.2335,-86.839,33.2335,-86.839,"Northwesterly flow was present over Central Alabama with an area of low pressure over Indiana and a strong ridge centered over the southwestern United States. A residual outflow boundary present over North Alabama located to the southeast of a surface front over West Tennessee prompted convective initiation during the afternoon hours of August 2. Severe thunderstorms developed along a broken line around midday, which moved southeastward through eastern Central Alabama during the afternoon. Numerous reports of damage, mainly to trees, were received from Etowah, Calhoun, St. Clair, and Talladega counties. A second complex of storms developed west of I-65 by late afternoon, with more wind damage reports from parts of Tuscaloosa, Hale, and Jefferson counties.","Local news media report of a home struck by lightning near the intersection of Pebble Ave and Winterhaven Dr in Alabaster. The fire department confirmed the strike hit a tree in the backyard, traveling to the home and hitting a gas meter, where a structural fire ensued.",CSV
202408,1,1838,202408,1,1839,193062,1191946,INDIANA,18,2024,August,Lightning,C,41,FAYETTE,ILN,01-AUG-24 18:38:00,EST-5,01-AUG-24 18:39:00,1,0,0,0,0.00K,0.00K,Emergency Manager,,,,,,,,,,,,1.0,N,CONNERSVILLE,1.0,N,CONNERSVILLE,39.6682,-85.126,39.6682,-85.126,Thunderstorms developed ahead of an upper level disturbance moving through the Ohio Valley.,A person carrying an aluminum umbrella pole was struck by lightning at a park pool.,CSV
202408,29,2105,202408,29,2105,195926,1211849,VIRGINIA,51,2024,August,Lightning,C,31,CAMPBELL,RNK,29-AUG-24 21:05:00,EST-5,29-AUG-24 21:05:00,0,0,0,0,0.50K,,911 Call Center,,,,,,,,,,,,1.0,SE,GLADYS,1.0,SE,GLADYS,37.16,-79.07,37.16,-79.07,"A strong cold front was centered over the region and was the trigger for several showers and storms. Some of these storms produced damaging winds which brought down many trees. Lightning from one thunderstorm struck a tree, which caught on fire, in Campbell county.",Lightning struck a tree which then caught on fire. Damage values are estimated.,CSV
202408,12,1550,202408,12,1550,196083,1213229,ARIZONA,4,2024,August,Lightning,C,5,COCONINO,FGZ,12-AUG-24 15:50:00,MST-7,12-AUG-24 15:50:00,2,0,0,0,0.00K,0.00K,Newspaper,,,,,,,,,,,,4.0,SW,PAGE,4.0,SW,PAGE,36.88,-111.51,36.88,-111.51,"Ample monoon moisture and slow moving thunderstorms brought lightning, heavy rain, and flash flooding to a few locations across northern Arizona.",Two people were injured by lightning near the Rim Overlook at Horseshoe Bend.,CSV
202412,28,900,202412,28,900,198792,1229039,LOUISIANA,22,2024,December,Lightning,C,17,CADDO,SHV,28-DEC-24 09:00:00,CST-6,28-DEC-24 09:00:00,0,0,0,0,10.00K,0.00K,Amateur Radio,,,,,,,,,,,,2.0,SW,DIXIE GARDENS,2.0,SW,DIXIE GARDENS,32.43,-93.72,32.43,-93.72,"Widespread strong to severe thunderstorms developed along and behind of an approaching cold front during the morning of December 28th. Some of these storms produced small hail and a couple of the stronger clusters caused some wind damage. Later in the afternoon, increased instability and low-level wind shear in the warm sector allowed a few supercells to develop across Central and Northeast Louisiana. Immediately behind the supercells, a quasi-linear convective system developed and moved quickly eastward producing a few instances of strong damaging winds.",Lightning was reported to have struck an apartment building near the intersection of Millicent Way and East Bert Kouns Industrial Loop.,CSV
202412,26,1048,202412,26,1048,198112,1224979,TEXAS,48,2024,December,Lightning,C,285,LAVACA,EWX,26-DEC-24 10:48:00,CST-6,26-DEC-24 10:48:00,0,0,0,0,50.00K,0.00K,Fire Department/Rescue,,,,,,,,,,,,2.0,SW,MONT,2.0,SW,MONT,29.3565,-97.0279,29.3565,-97.0279,"An upper-level shortwave trough moved across Texas, and a warm front moved through South-Central Texas from the south. Thunderstorms developed along this front. Lightning caused an oil field tank battery to catch fire.",A thunderstorm produced lightning that caused an oil field tank battery to catch fire near Sweet Home.,CSV
202405,16,1700,202405,16,1700,189937,1188491,TEXAS,48,2024,May,Lightning,C,201,HARRIS,HGX,16-MAY-24 17:00:00,CST-6,16-MAY-24 17:00:00,0,0,0,1,50.00K,0.00K,Broadcast Media,,,,,,,,,,,,2.0,NW,HOUSTON WEISER ARPT,2.0,NW,HOUSTON WEISER ARPT,29.9529,-95.6585,29.9529,-95.6585,"On the evening of May 16, a derecho moved into SE TX. This resulted in extensive wind damage across much of the Greater Houston area, including much of Downtown Houston. Maximum wind gusts were estimated to have reached over 100 mph. Additionally, the system produced two tornadoes and widespread flash flooding. Power outages resulting from the derecho lasted multiple days for hundreds of thousands of people.",Lighting fire destroyed a mobile home. One fatality resulted.,CSV
202405,22,1522,202405,22,1522,190084,1171769,TENNESSEE,47,2024,May,Lightning,C,187,WILLIAMSON,OHX,22-MAY-24 15:22:00,CST-6,22-MAY-24 15:22:00,0,0,0,0,100.00K,0.00K,Broadcast Media,,,,,,,,,,,,1.0,W,MUDSINK,1.0,W,MUDSINK,35.9189,-86.8428,35.9189,-86.8428,"An active May pattern continued into May 22, 2024, as additional severe thunderstorms impacted Middle Tennessee. Damaging winds were the primary threat with this activity with numerous trees, mainly in eastern Middle Tennessee, uprooted or snapped. Flash flooding was also reported in Houston County where water rescues had to be performed at a daycare.","A lightning strike was the likely cause of a house fire along Heritage Court in Franklin. Significant damage occurred to the garage of the home, and one resident was rescued. Damages are a rough estimate.",CSV
202408,13,602,202408,13,605,196158,1214164,WASHINGTON,53,2024,August,Lightning,C,3,ASOTIN,OTX,13-AUG-24 06:02:00,PST-8,13-AUG-24 06:05:00,0,0,0,0,1.00K,0.00K,Newspaper,,,,,,,,,,,,2.0,SSW,CLARKSTON HGTS,2.0,SSW,CLARKSTON HGTS,46.39,-117.08,46.39,-117.08,Lightning sparked a small house fire in Clarkston.,Lightning ignited a house fire on the 2300 block of 19th Street. Fire department quickly extinguished the portion of the roof that ignited.,CSV
202405,22,1620,202405,22,1620,190084,1171782,TENNESSEE,47,2024,May,Lightning,C,149,RUTHERFORD,OHX,22-MAY-24 16:20:00,CST-6,22-MAY-24 16:20:00,0,0,0,0,100.00K,0.00K,Broadcast Media,,,,,,,,,,,,2.0,NNE,BARFIELD,2.0,NNE,BARFIELD,35.7996,-86.4352,35.7996,-86.4352,"An active May pattern continued into May 22, 2024, as additional severe thunderstorms impacted Middle Tennessee. Damaging winds were the primary threat with this activity with numerous trees, mainly in eastern Middle Tennessee, uprooted or snapped. Flash flooding was also reported in Houston County where water rescues had to be performed at a daycare.",The attic of a home along Tin Cup Drive in Murfreesboro caught fire after lightning struck the home. Firefighters arrived and were able to quickly extinguish the flames before it spread further. No injuries were reported. Damages are a rough estimate.,CSV
202409,25,1615,202409,25,1620,196581,1219236,IDAHO,16,2024,September,Lightning,C,79,SHOSHONE,OTX,25-SEP-24 16:15:00,PST-8,25-SEP-24 16:20:00,0,0,0,0,1.00K,0.00K,Public,,,,,,,,,,,,1.0,N,OSBURN,1.0,N,OSBURN,47.51,-116.0,47.51,-116.0,"A strong dry cold front pushed through the region on September 25. It generated several thunderstorms over Idaho Panhandle as it passed. The storms brought severe gusty outflow winds from downdrafts. The winds caused damage to trees and roofs. Recorded wind gusts ranged from up to 67 MPH. There was also a report of severe hail. A downed tree caused a fatality in Sandpoint. It brought dust storm to the Moscow area. Power outages reported by county: 1710 - Benewah, 18178 - Bonner, 3413 Boundary, 3328 -Shoshone, 8193 - Latah, 1019 - Kootenai.",Tree was struck by lightning. Tree split into two with one side falling on to the fence and house.,CSV
202409,18,1630,202409,18,1630,196481,1218190,FLORIDA,12,2024,September,Lightning,C,11,BROWARD,MFL,18-SEP-24 16:30:00,EST-5,18-SEP-24 16:30:00,0,0,0,0,50.00K,0.00K,Broadcast Media,,,,,,,,,,,,1.0,NNE,HOLLYWOOD N PERRY AR,1.0,NNE,HOLLYWOOD N PERRY AR,26.0104,-80.2236,26.0104,-80.2236,"With a mid-level trough over the Florida Peninsula, and a stationary front positioned over Central Florida, plentiful moisture and instability was in place over South Florida. This resulted in numerous showers and thunderstorms during the afternoon and evening of September 18th across South Florida.","Broadcast media reported that lightning struck a transformer in the 6800 block of Tyler Street in Hollywood, which knocked down a power line onto a home and started a fire. The fire caused significant damage to the home and property. The residents of the home were able to get out safely. Time is approximate and is based on the timing of a severe thunderstorm that was affecting the area at the time, as well as from National Lightning Detection Network data showing several cloud-to-ground strikes in close proximity.",CSV
202409,18,1615,202409,18,1615,196481,1215697,FLORIDA,12,2024,September,Lightning,C,11,BROWARD,MFL,18-SEP-24 16:15:00,EST-5,18-SEP-24 16:15:00,0,0,1,0,0.00K,0.00K,Broadcast Media,,,,,,,,,,,,1.0,NE,HOLLYWOOD N PERRY AR,1.0,NE,HOLLYWOOD N PERRY AR,26.0053,-80.2215,26.0053,-80.2215,"With a mid-level trough over the Florida Peninsula, and a stationary front positioned over Central Florida, plentiful moisture and instability was in place over South Florida. This resulted in numerous showers and thunderstorms during the afternoon and evening of September 18th across South Florida.","Broadcast media reported that a 16-year-old boy was killed by lightning after being struck while riding a bicycle in the 600 block of SW 67th Avenue in Pembroke Pines during a thunderstorm. The boy was taken to a nearby hospital where he was later pronounced dead. Time is approximate and is based on the timing of a severe thunderstorm that was affecting the area at the time, as well as from National Lightning Detection Network data showing several cloud-to-ground strikes in close proximity.",CSV
202409,3,1411,202409,3,1411,196249,1214287,TEXAS,48,2024,September,Lightning,C,61,CAMERON,BRO,03-SEP-24 14:11:00,CST-6,03-SEP-24 14:11:00,0,0,0,0,5.40K,0.00K,Public,,,,,,,,,,,,2.0,SW,PRIMERA,2.0,SW,PRIMERA,26.212,-97.6925,26.212,-97.6925,"An influx of deep tropical moisture associated with a weak upper level disturbance and associated low pressure system along the Lower Texas coast provided daily, mainly afternoon showers and thunderstorms between September 2 and 5. The precipitation favored the lower Valley (Cameron/Willacy County).  On the 3rd, a resident of Harlingen reported a direct cloud-to-ground lightning strike on her home which resulted in damage.","A resident of central Harlingen reported a direct lightning strike to the home.  Approximate time is based on the report, which noted that the strike came just before torrential rains that were also reported at nearby Valley International Airport (2.4 miles to the east-northeast). Damage included roof and decking blown out and underlaying PVC pipe damage.  No fire was reported.",CSV
202409,14,2100,202409,14,2300,196891,1217865,TEXAS,48,2024,September,Lightning,C,479,WEBB,CRP,14-SEP-24 21:00:00,CST-6,14-SEP-24 23:00:00,0,0,0,0,10.00K,0.00K,Newspaper,,,,,,,,,,,,2.0,N,(LRD)LAREDO INTL ARP,2.0,N,(LRD)LAREDO INTL ARP,27.5614,-99.4638,27.5614,-99.4638,A very strong thunderstorm peaked in intensity as it crossed from Mexico into the Laredo area on the night of September 14th. This initial storm contained heavy rain rates and weas then followed by a few other storms in wake during the early morning hours of the 15th. This combination and the flash prone urban area lead to quick flooding on streets and water rescues. Frequent lightning impacted power lines and caused power outages across the city.,"Lightning struck the 1600 block of Jacaman Rd, that resulted in a fire. Multiple power lines were reported down. There were temporary power outages across the city, with over 2,000 people without electricity through the morning hours on the 15th.",CSV
202408,31,1650,202408,31,1650,195867,1211397,FLORIDA,12,2024,August,Lightning,C,21,COLLIER,MFL,31-AUG-24 16:50:00,EST-5,31-AUG-24 16:50:00,1,0,1,0,0.00K,0.00K,Broadcast Media,,,,,,,,,,,,0.0,WNW,NAPLES,0.0,WNW,NAPLES,26.1314,-81.8068,26.1314,-81.8068,"With afternoon sea breezes and diurnal heating, the development of showers and thunderstorms was fueled across inland and Southwest Florida in the afternoon of August 31st. There were scattered thunderstorms across the local Gulf waters which led to hazards such as gusty winds and lightning along coastal Collier County.","Local broadcast media reported two males sustaining injuries from a lightning strike in the water next to Naples Pier. Time is based on data from the National Lightning Detection Network. Two weeks later, local media reported that one of the men passed away after being in critical condition since the lightning strike.",CSV
